Institutions,Date,Title,Subject Area,Journal,Link
"Korea University","2025-08-24","Clinical evaluation of the aperture shape controller in volumetric modulated arc therapy: Effects on MLC and jaw motion complexity, plan quality, and deliverability","Biomedical","","https://pubmed.ncbi.nlm.nih.gov/40849837/?utm_source=Other&utm_medium=rss&utm_campaign=pubmed-2&utm_content=12guA9dSu1tGGvNP7mhhDa45fpbWpGPzILFj69wJJFdG48xkuI&fc=20250822205125&ff=20250824194107&v=2.18.0.post9+e462414"
"IBS","2025-08-24","CD20+ natural killer cells are polyfunctional, memory-like cells that are enriched in inflammatory disorders","Multidisciplinary","cell","https://pubmed.ncbi.nlm.nih.gov/40849886/?utm_source=Other&utm_medium=rss&utm_campaign=pubmed-2&utm_content=1HyCEy3kccvK7zE0-AQi3b_3KChicv5K_t8YL3UITyEWtrEgUY&fc=20250822210237&ff=20250824194107&v=2.18.0.post9+e462414"
"IBS","2025-08-24","A dual-domain regularization method for ring artifact removal of X-ray CT","Biomedical","","https://pubmed.ncbi.nlm.nih.gov/40849877/?utm_source=Other&utm_medium=rss&utm_campaign=pubmed-2&utm_content=1HyCEy3kccvK7zE0-AQi3b_3KChicv5K_t8YL3UITyEWtrEgUY&fc=20250822210237&ff=20250824194107&v=2.18.0.post9+e462414"
"IBS","2025-08-24","Awareness and management of stage 3 chronic kidney disease among primary care practitioners in Italy: a nation-wide observational study","Biomedical","","https://pubmed.ncbi.nlm.nih.gov/40849875/?utm_source=Other&utm_medium=rss&utm_campaign=pubmed-2&utm_content=1HyCEy3kccvK7zE0-AQi3b_3KChicv5K_t8YL3UITyEWtrEgUY&fc=20250822210237&ff=20250824194107&v=2.18.0.post9+e462414"
"IBS","2025-08-24","Disparities in Fungal Diagnostic Capacity Across Chinese Hospitals: A Nationwide Survey Highlighting Gaps in Molecular Testing and GDP-Linked Inequalities","Multidisciplinary","","https://pubmed.ncbi.nlm.nih.gov/40849872/?utm_source=Other&utm_medium=rss&utm_campaign=pubmed-2&utm_content=1HyCEy3kccvK7zE0-AQi3b_3KChicv5K_t8YL3UITyEWtrEgUY&fc=20250822210237&ff=20250824194107&v=2.18.0.post9+e462414"
"IBS","2025-08-24","Drug repurposing in oncology: a path beyond the bottleneck","Cancer Research","","https://pubmed.ncbi.nlm.nih.gov/40849858/?utm_source=Other&utm_medium=rss&utm_campaign=pubmed-2&utm_content=1HyCEy3kccvK7zE0-AQi3b_3KChicv5K_t8YL3UITyEWtrEgUY&fc=20250822210237&ff=20250824194107&v=2.18.0.post9+e462414"
"IBS","2025-08-24","Development of dual-ended readout PET detectors achieving high 3D position resolution and high timing resolution using NINO and PICO2023 ASICs","Multidisciplinary","","https://pubmed.ncbi.nlm.nih.gov/40849855/?utm_source=Other&utm_medium=rss&utm_campaign=pubmed-2&utm_content=1HyCEy3kccvK7zE0-AQi3b_3KChicv5K_t8YL3UITyEWtrEgUY&fc=20250822210237&ff=20250824194107&v=2.18.0.post9+e462414"
"IBS","2025-08-24","Reversible Magneto-Ionic Control of Exchange Bias in Coupled Spin-Valve-Like Heterostructures","Multidisciplinary","","https://pubmed.ncbi.nlm.nih.gov/40849841/?utm_source=Other&utm_medium=rss&utm_campaign=pubmed-2&utm_content=1HyCEy3kccvK7zE0-AQi3b_3KChicv5K_t8YL3UITyEWtrEgUY&fc=20250822210237&ff=20250824194107&v=2.18.0.post9+e462414"
"IBS","2025-08-24","Impact of deep learning model uncertainty on manual corrections to MRI-based auto-segmentation in prostate cancer radiotherapy","Cancer Research","","https://pubmed.ncbi.nlm.nih.gov/40849835/?utm_source=Other&utm_medium=rss&utm_campaign=pubmed-2&utm_content=1HyCEy3kccvK7zE0-AQi3b_3KChicv5K_t8YL3UITyEWtrEgUY&fc=20250822210237&ff=20250824194107&v=2.18.0.post9+e462414"
"IBS","2025-08-24","Association between high-sensitivity C-reactive protein and ischemic stroke outcomes under different glucose metabolism statuses: a retrospective cohort study","Multidisciplinary","","https://pubmed.ncbi.nlm.nih.gov/40849830/?utm_source=Other&utm_medium=rss&utm_campaign=pubmed-2&utm_content=1HyCEy3kccvK7zE0-AQi3b_3KChicv5K_t8YL3UITyEWtrEgUY&fc=20250822210237&ff=20250824194107&v=2.18.0.post9+e462414"
"IBS","2025-08-24","Takotsubo syndrome: Unraveling the mystery behind its triggers (Review)","Biomedical","","https://pubmed.ncbi.nlm.nih.gov/40849825/?utm_source=Other&utm_medium=rss&utm_campaign=pubmed-2&utm_content=1HyCEy3kccvK7zE0-AQi3b_3KChicv5K_t8YL3UITyEWtrEgUY&fc=20250822210237&ff=20250824194107&v=2.18.0.post9+e462414"
"IBS","2025-08-24","Nanoparticle‑based delivery systems for targeted therapy in brain tumors: Progress, challenges and perspectives (Review)","Cancer Research","","https://pubmed.ncbi.nlm.nih.gov/40849813/?utm_source=Other&utm_medium=rss&utm_campaign=pubmed-2&utm_content=1HyCEy3kccvK7zE0-AQi3b_3KChicv5K_t8YL3UITyEWtrEgUY&fc=20250822210237&ff=20250824194107&v=2.18.0.post9+e462414"
"IBS","2025-08-24","Underwater Instant Adhesive Hydrogel Interfaces for Robust Biosensing on Diverse Species","Multidisciplinary","","https://pubmed.ncbi.nlm.nih.gov/40849798/?utm_source=Other&utm_medium=rss&utm_campaign=pubmed-2&utm_content=1HyCEy3kccvK7zE0-AQi3b_3KChicv5K_t8YL3UITyEWtrEgUY&fc=20250822210237&ff=20250824194107&v=2.18.0.post9+e462414"
"IBS","2025-08-24","Reconfigurable Counterion Gradient around Charged Metal Nanoparticles Enables Self-Rectifying and Volatile Artificial Synapse","Materials Science","","https://pubmed.ncbi.nlm.nih.gov/40849797/?utm_source=Other&utm_medium=rss&utm_campaign=pubmed-2&utm_content=1HyCEy3kccvK7zE0-AQi3b_3KChicv5K_t8YL3UITyEWtrEgUY&fc=20250822210237&ff=20250824194107&v=2.18.0.post9+e462414"
"IBS","2025-08-24","Potential-dependent O-O Coupling Mechanism for Oxygen Evolution Reaction on Ruthenium Dioxide","Multidisciplinary","","https://pubmed.ncbi.nlm.nih.gov/40849792/?utm_source=Other&utm_medium=rss&utm_campaign=pubmed-2&utm_content=1HyCEy3kccvK7zE0-AQi3b_3KChicv5K_t8YL3UITyEWtrEgUY&fc=20250822210237&ff=20250824194107&v=2.18.0.post9+e462414"
"IBS","2025-08-24","A Lipid with Lewis Pair-Mediated Targeting and Multiple Stimuli-Responsive Delivery of Antibiotics for Bacterial Infections","Multidisciplinary","","https://pubmed.ncbi.nlm.nih.gov/40849788/?utm_source=Other&utm_medium=rss&utm_campaign=pubmed-2&utm_content=1HyCEy3kccvK7zE0-AQi3b_3KChicv5K_t8YL3UITyEWtrEgUY&fc=20250822210237&ff=20250824194107&v=2.18.0.post9+e462414"
"IBS","2025-08-24","Druggable Targets in Zika Virus: A Systematic Review of Therapeutic Opportunities in Brazil","Multidisciplinary","","https://pubmed.ncbi.nlm.nih.gov/40849775/?utm_source=Other&utm_medium=rss&utm_campaign=pubmed-2&utm_content=1HyCEy3kccvK7zE0-AQi3b_3KChicv5K_t8YL3UITyEWtrEgUY&fc=20250822210237&ff=20250824194107&v=2.18.0.post9+e462414"
"IBS","2025-08-24","Unraveling Complex Interactions Mechanisms Linking PTSD and Chronic Diseases","Multidisciplinary","","https://pubmed.ncbi.nlm.nih.gov/40849771/?utm_source=Other&utm_medium=rss&utm_campaign=pubmed-2&utm_content=1HyCEy3kccvK7zE0-AQi3b_3KChicv5K_t8YL3UITyEWtrEgUY&fc=20250822210237&ff=20250824194107&v=2.18.0.post9+e462414"
"IBS","2025-08-24","Nano-curcumin for the Treatment and Management of Diabetes Mellitus","Biomedical","","https://pubmed.ncbi.nlm.nih.gov/40849768/?utm_source=Other&utm_medium=rss&utm_campaign=pubmed-2&utm_content=1HyCEy3kccvK7zE0-AQi3b_3KChicv5K_t8YL3UITyEWtrEgUY&fc=20250822210237&ff=20250824194107&v=2.18.0.post9+e462414"
"IBS","2025-08-24","Association between Suicidal Ideation and Immune Parameters in Firstepisode Patients with Schizophrenia","Biomedical","","https://pubmed.ncbi.nlm.nih.gov/40849747/?utm_source=Other&utm_medium=rss&utm_campaign=pubmed-2&utm_content=1HyCEy3kccvK7zE0-AQi3b_3KChicv5K_t8YL3UITyEWtrEgUY&fc=20250822210237&ff=20250824194107&v=2.18.0.post9+e462414"
"SNU","2025-08-24","Early postnatal right-to-left patent ductus arteriosus shunting and severe outcomes in neonates with congenital diaphragmatic hernia: a retrospective cohort study","Multidisciplinary","","https://pubmed.ncbi.nlm.nih.gov/40849638/?utm_source=Other&utm_medium=rss&utm_campaign=pubmed-2&utm_content=1bo4uOs-bB_ZLOeoRMDuMyKrqOCTTJrR8i4c8aBDtpAcbJ09ch&fc=20250822163228&ff=20250824151739&v=2.18.0.post9+e462414"
"IBS","2025-08-24","Phosphoprotein Profile of Ameloblastoma","Multidisciplinary","","https://pubmed.ncbi.nlm.nih.gov/40849725/?utm_source=Other&utm_medium=rss&utm_campaign=pubmed-2&utm_content=1HyCEy3kccvK7zE0-AQi3b_3KChicv5K_t8YL3UITyEWtrEgUY&fc=20250822210237&ff=20250824151738&v=2.18.0.post9+e462414"
"IBS","2025-08-24","METCAM/MUC18 is a Biomarker and Therapeutic Target for Prostate Cancer","Cancer Research","cell","https://pubmed.ncbi.nlm.nih.gov/40849720/?utm_source=Other&utm_medium=rss&utm_campaign=pubmed-2&utm_content=1HyCEy3kccvK7zE0-AQi3b_3KChicv5K_t8YL3UITyEWtrEgUY&fc=20250822210237&ff=20250824151738&v=2.18.0.post9+e462414"
"IBS","2025-08-24","The Impact of Nurse-Led Intervention on Breast Cancer Screening and Early Detection in China: Randomized Control Trial","Cancer Research","","https://pubmed.ncbi.nlm.nih.gov/40849715/?utm_source=Other&utm_medium=rss&utm_campaign=pubmed-2&utm_content=1HyCEy3kccvK7zE0-AQi3b_3KChicv5K_t8YL3UITyEWtrEgUY&fc=20250822210237&ff=20250824151738&v=2.18.0.post9+e462414"
"IBS","2025-08-24","Biosynthesis of Copper Nanoparticles Using Passiflora Flower Extract and Study Their Antimicrobial, Antioxidant And Anticancer Activity","Cancer Research","cell","https://pubmed.ncbi.nlm.nih.gov/40849712/?utm_source=Other&utm_medium=rss&utm_campaign=pubmed-2&utm_content=1HyCEy3kccvK7zE0-AQi3b_3KChicv5K_t8YL3UITyEWtrEgUY&fc=20250822210237&ff=20250824151738&v=2.18.0.post9+e462414"
"IBS","2025-08-24","Interleukin-13 (rs20541 A/G) Gene Polymorphism and Chance of Acquiring Hepatitis B in the Egyptian Population","Multidisciplinary","","https://pubmed.ncbi.nlm.nih.gov/40849710/?utm_source=Other&utm_medium=rss&utm_campaign=pubmed-2&utm_content=1HyCEy3kccvK7zE0-AQi3b_3KChicv5K_t8YL3UITyEWtrEgUY&fc=20250822210237&ff=20250824151738&v=2.18.0.post9+e462414"
"IBS","2025-08-24","Mortality by Childhood Acute Lymphoblastic Leukemia: A Regional Analysis in Peru and Ecuador","Multidisciplinary","","https://pubmed.ncbi.nlm.nih.gov/40849704/?utm_source=Other&utm_medium=rss&utm_campaign=pubmed-2&utm_content=1HyCEy3kccvK7zE0-AQi3b_3KChicv5K_t8YL3UITyEWtrEgUY&fc=20250822210237&ff=20250824151738&v=2.18.0.post9+e462414"
"IBS","2025-08-24","Association of Interleukin-27 (IL-27) rs181206 T/C and rs17855750 T/G Gene Polymorphisms and the Risk of Hepatitis B Infection among Egyptians","Multidisciplinary","","https://pubmed.ncbi.nlm.nih.gov/40849701/?utm_source=Other&utm_medium=rss&utm_campaign=pubmed-2&utm_content=1HyCEy3kccvK7zE0-AQi3b_3KChicv5K_t8YL3UITyEWtrEgUY&fc=20250822210237&ff=20250824151738&v=2.18.0.post9+e462414"
"IBS","2025-08-24","The Functional Interplay among GAD2, GABRG2, and CACNA1G Genes in Cancers","Cancer Research","","https://pubmed.ncbi.nlm.nih.gov/40849687/?utm_source=Other&utm_medium=rss&utm_campaign=pubmed-2&utm_content=1HyCEy3kccvK7zE0-AQi3b_3KChicv5K_t8YL3UITyEWtrEgUY&fc=20250822210237&ff=20250824151738&v=2.18.0.post9+e462414"
"IBS","2025-08-24","Dynamical properties of chromatin provide insights into key folding principles","Multidisciplinary","nature","https://pubmed.ncbi.nlm.nih.gov/40849682/?utm_source=Other&utm_medium=rss&utm_campaign=pubmed-2&utm_content=1HyCEy3kccvK7zE0-AQi3b_3KChicv5K_t8YL3UITyEWtrEgUY&fc=20250822210237&ff=20250824151738&v=2.18.0.post9+e462414"
"IBS","2025-08-24","SugarcaneOmics: An integrative multi-omics platform for sugarcane research","Multidisciplinary","","https://pubmed.ncbi.nlm.nih.gov/40849681/?utm_source=Other&utm_medium=rss&utm_campaign=pubmed-2&utm_content=1HyCEy3kccvK7zE0-AQi3b_3KChicv5K_t8YL3UITyEWtrEgUY&fc=20250822210237&ff=20250824151738&v=2.18.0.post9+e462414"
"IBS","2025-08-24","Carbon Monoxide Alleviates Cardiomyocyte Pyroptosis in Diabetic Cardiomyopathy by Downregulating the IL-33/ST2L Axis","Multidisciplinary","","https://pubmed.ncbi.nlm.nih.gov/40849678/?utm_source=Other&utm_medium=rss&utm_campaign=pubmed-2&utm_content=1HyCEy3kccvK7zE0-AQi3b_3KChicv5K_t8YL3UITyEWtrEgUY&fc=20250822210237&ff=20250824151738&v=2.18.0.post9+e462414"
"IBS","2025-08-24","Cost-effectiveness of spinal manipulation, exercise, and self-management for spinal pain","Multidisciplinary","","https://pubmed.ncbi.nlm.nih.gov/40849676/?utm_source=Other&utm_medium=rss&utm_campaign=pubmed-2&utm_content=1HyCEy3kccvK7zE0-AQi3b_3KChicv5K_t8YL3UITyEWtrEgUY&fc=20250822210237&ff=20250824151738&v=2.18.0.post9+e462414"
"IBS","2025-08-24","Comparison of the Clinical Efficacy of the Anterolateral and Regular Approaches for Hip Joint Puncture: A Randomized Cross-Over Trial","Biomedical","","https://pubmed.ncbi.nlm.nih.gov/40849673/?utm_source=Other&utm_medium=rss&utm_campaign=pubmed-2&utm_content=1HyCEy3kccvK7zE0-AQi3b_3KChicv5K_t8YL3UITyEWtrEgUY&fc=20250822210237&ff=20250824151738&v=2.18.0.post9+e462414"
"IBS","2025-08-24","Integrated analysis of O/K-antigen biosynthesis diversity and molecular serotyping scheme development of Vibrio alginolyticus","Multidisciplinary","","https://pubmed.ncbi.nlm.nih.gov/40849642/?utm_source=Other&utm_medium=rss&utm_campaign=pubmed-2&utm_content=1HyCEy3kccvK7zE0-AQi3b_3KChicv5K_t8YL3UITyEWtrEgUY&fc=20250822210237&ff=20250824151738&v=2.18.0.post9+e462414"
"IBS & KAIST & SNU","2025-08-23","Relationship between caregiving burden and alterations in circadian rhythms among spousal caregivers of individuals with cognitive impairment","Neuroscience","","https://pubmed.ncbi.nlm.nih.gov/40849457/?utm_source=Other&utm_medium=rss&utm_campaign=pubmed-2&utm_content=1lGTpA7S74whuNVC_kQy0F4ncgCxeB9B9U0hbi6Wldiv2cIgV2&fc=20250822163126&ff=20250824151739&v=2.18.0.post9+e462414"
"IBS & KAIST","2025-08-23","High fat diet enhances catalase loading into adipose tissue derived extracellular vesicles with limited effect on oxidative stress","Multidisciplinary","cell","https://pubmed.ncbi.nlm.nih.gov/40849334/?utm_source=Other&utm_medium=rss&utm_campaign=pubmed-2&utm_content=1lGTpA7S74whuNVC_kQy0F4ncgCxeB9B9U0hbi6Wldiv2cIgV2&fc=20250822163126&ff=20250824151739&v=2.18.0.post9+e462414"
"IBS & KAIST","2025-08-23","A continuous real-world dataset comprising wearable-based heart rate variability alongside sleep diaries","Biomedical","","https://pubmed.ncbi.nlm.nih.gov/40849317/?utm_source=Other&utm_medium=rss&utm_campaign=pubmed-2&utm_content=1lGTpA7S74whuNVC_kQy0F4ncgCxeB9B9U0hbi6Wldiv2cIgV2&fc=20250822163126&ff=20250824151739&v=2.18.0.post9+e462414"
"KAIST & SNU","2025-08-23","Exploiting anisotropic orientation in Nanoparticle-Aided Cryo-Electron microscopy sampling","Multidisciplinary","","https://pubmed.ncbi.nlm.nih.gov/40848865/?utm_source=Other&utm_medium=rss&utm_campaign=pubmed-2&utm_content=1lGTpA7S74whuNVC_kQy0F4ncgCxeB9B9U0hbi6Wldiv2cIgV2&fc=20250822163126&ff=20250824151739&v=2.18.0.post9+e462414"
"KAIST & SNU","2025-08-23","The Influence of polycyclic aromatic hydrocarbons exposure on the gut microbiome composition and inflammatory responses","Multidisciplinary","","https://pubmed.ncbi.nlm.nih.gov/40848419/?utm_source=Other&utm_medium=rss&utm_campaign=pubmed-2&utm_content=1lGTpA7S74whuNVC_kQy0F4ncgCxeB9B9U0hbi6Wldiv2cIgV2&fc=20250822163126&ff=20250824151739&v=2.18.0.post9+e462414"
"KAIST & SNU","2025-08-23","Photo-Fenton mineralization of aquatic organic pollutants in visible-light-driven photocatalysis: Revisiting Fe<sup>3+</sup> reduction and noble metal necessity","Multidisciplinary","","https://pubmed.ncbi.nlm.nih.gov/40848412/?utm_source=Other&utm_medium=rss&utm_campaign=pubmed-2&utm_content=1lGTpA7S74whuNVC_kQy0F4ncgCxeB9B9U0hbi6Wldiv2cIgV2&fc=20250822163126&ff=20250824151739&v=2.18.0.post9+e462414"
"KAIST & Korea University","2025-08-23","An ultrasensitive diagnostic system for minuscule level of hemolytic uremic syndrome","Multidisciplinary","","https://pubmed.ncbi.nlm.nih.gov/40848339/?utm_source=Other&utm_medium=rss&utm_campaign=pubmed-2&utm_content=1lGTpA7S74whuNVC_kQy0F4ncgCxeB9B9U0hbi6Wldiv2cIgV2&fc=20250822163126&ff=20250824151739&v=2.18.0.post9+e462414"
"KAIST & SNU","2025-08-23","Middle Interlayer Engineered Ferroelectric NAND Flash Overcoming Reliability and Stability Bottlenecks for Next-Generation High-Density Storage Systems","Multidisciplinary","","https://pubmed.ncbi.nlm.nih.gov/40847772/?utm_source=Other&utm_medium=rss&utm_campaign=pubmed-2&utm_content=1lGTpA7S74whuNVC_kQy0F4ncgCxeB9B9U0hbi6Wldiv2cIgV2&fc=20250822163126&ff=20250824151739&v=2.18.0.post9+e462414"
"KAIST & Korea University & SNU","2025-08-23","Ferroelectric Quantum Dots for Retinomorphic In-Sensor Computing","Multidisciplinary","","https://pubmed.ncbi.nlm.nih.gov/40847700/?utm_source=Other&utm_medium=rss&utm_campaign=pubmed-2&utm_content=1lGTpA7S74whuNVC_kQy0F4ncgCxeB9B9U0hbi6Wldiv2cIgV2&fc=20250822163126&ff=20250824151739&v=2.18.0.post9+e462414"
"KAIST","2025-08-23","Integrating analytical quality by design into bioanalytical method development: an HPLC-FLD method for quantification of alectinib in biological matrix","Multidisciplinary","","https://pubmed.ncbi.nlm.nih.gov/40847406/?utm_source=Other&utm_medium=rss&utm_campaign=pubmed-2&utm_content=1lGTpA7S74whuNVC_kQy0F4ncgCxeB9B9U0hbi6Wldiv2cIgV2&fc=20250822163126&ff=20250824151739&v=2.18.0.post9+e462414"
"SNU","2025-08-23","Spatial host-microbiome profiling demonstrates bacterial-associated host transcriptional alterations in pediatric ileal Crohn's disease","Multidisciplinary","cell","https://pubmed.ncbi.nlm.nih.gov/40849632/?utm_source=Other&utm_medium=rss&utm_campaign=pubmed-2&utm_content=1bo4uOs-bB_ZLOeoRMDuMyKrqOCTTJrR8i4c8aBDtpAcbJ09ch&fc=20250822163228&ff=20250824151739&v=2.18.0.post9+e462414"
"SNU","2025-08-23","Immunoglobulin G dynamics and outcomes of hypogammaglobulinemia in liver transplant recipients","Biomedical","","https://pubmed.ncbi.nlm.nih.gov/40849571/?utm_source=Other&utm_medium=rss&utm_campaign=pubmed-2&utm_content=1bo4uOs-bB_ZLOeoRMDuMyKrqOCTTJrR8i4c8aBDtpAcbJ09ch&fc=20250822163228&ff=20250824151739&v=2.18.0.post9+e462414"
"SNU","2025-08-23","The analysis of landscape design and plant selection under deep learning","Computer Science","","https://pubmed.ncbi.nlm.nih.gov/40849568/?utm_source=Other&utm_medium=rss&utm_campaign=pubmed-2&utm_content=1bo4uOs-bB_ZLOeoRMDuMyKrqOCTTJrR8i4c8aBDtpAcbJ09ch&fc=20250822163228&ff=20250824151739&v=2.18.0.post9+e462414"
"SNU","2025-08-23","Impact of ankle injuries on joint range of motion and muscle viscoelasticity in female amateur volleyball athletes","Multidisciplinary","","https://pubmed.ncbi.nlm.nih.gov/40849481/?utm_source=Other&utm_medium=rss&utm_campaign=pubmed-2&utm_content=1bo4uOs-bB_ZLOeoRMDuMyKrqOCTTJrR8i4c8aBDtpAcbJ09ch&fc=20250822163228&ff=20250824151739&v=2.18.0.post9+e462414"
"SNU","2025-08-23","Dural arteriovenous fistula presenting as paradoxical contralateral pulsatile tinnitus due to contralateral otosclerosis-induced mixed hearing loss","Biomedical","","https://pubmed.ncbi.nlm.nih.gov/40849398/?utm_source=Other&utm_medium=rss&utm_campaign=pubmed-2&utm_content=1bo4uOs-bB_ZLOeoRMDuMyKrqOCTTJrR8i4c8aBDtpAcbJ09ch&fc=20250822163228&ff=20250824151739&v=2.18.0.post9+e462414"
"SNU","2025-08-23","Optimal Number of Lymph Nodes Retrieved to Lower the Risk of False N0 for Patients with Pancreatic Cancer Undergoing Curative Surgery","Cancer Research","","https://pubmed.ncbi.nlm.nih.gov/40849376/?utm_source=Other&utm_medium=rss&utm_campaign=pubmed-2&utm_content=1bo4uOs-bB_ZLOeoRMDuMyKrqOCTTJrR8i4c8aBDtpAcbJ09ch&fc=20250822163228&ff=20250824151739&v=2.18.0.post9+e462414"
"IBS & SNU","2025-08-23","ASO Author Reflections: Robotic Right Anterior Sectionectomy Using Extrahepatic Glissonean Approach and ICG Fluorescence-Enhancing Precision in Complex Liver Surgery","Multidisciplinary","","https://pubmed.ncbi.nlm.nih.gov/40849375/?utm_source=Other&utm_medium=rss&utm_campaign=pubmed-2&utm_content=1bo4uOs-bB_ZLOeoRMDuMyKrqOCTTJrR8i4c8aBDtpAcbJ09ch&fc=20250822163228&ff=20250824151739&v=2.18.0.post9+e462414"
"SNU","2025-08-23","Impact of smoking and physical activity on cardiovascular outcomes in type 2 diabetes across steatotic liver disease categories","Biomedical","","https://pubmed.ncbi.nlm.nih.gov/40849338/?utm_source=Other&utm_medium=rss&utm_campaign=pubmed-2&utm_content=1bo4uOs-bB_ZLOeoRMDuMyKrqOCTTJrR8i4c8aBDtpAcbJ09ch&fc=20250822163228&ff=20250824151739&v=2.18.0.post9+e462414"
"SNU","2025-08-23","One-carbon metabolic pathway is a novel molecular signature for CD44-positive intestinal-type gastric cancer","Cancer Research","cell","https://pubmed.ncbi.nlm.nih.gov/40849307/?utm_source=Other&utm_medium=rss&utm_campaign=pubmed-2&utm_content=1bo4uOs-bB_ZLOeoRMDuMyKrqOCTTJrR8i4c8aBDtpAcbJ09ch&fc=20250822163228&ff=20250824151739&v=2.18.0.post9+e462414"
"SNU","2025-08-23","Cluster-based read-across of ToxCast data identifies buprofezin as a partial PPARγ agonist with obesogenic potential","Multidisciplinary","","https://pubmed.ncbi.nlm.nih.gov/40848978/?utm_source=Other&utm_medium=rss&utm_campaign=pubmed-2&utm_content=1bo4uOs-bB_ZLOeoRMDuMyKrqOCTTJrR8i4c8aBDtpAcbJ09ch&fc=20250822163228&ff=20250824151739&v=2.18.0.post9+e462414"
"SNU","2025-08-23","Biorefinery of avocado seed waste for sustainable production of bioplastics and functionalized silver nanocomposites","Multidisciplinary","","https://pubmed.ncbi.nlm.nih.gov/40848789/?utm_source=Other&utm_medium=rss&utm_campaign=pubmed-2&utm_content=1bo4uOs-bB_ZLOeoRMDuMyKrqOCTTJrR8i4c8aBDtpAcbJ09ch&fc=20250822163228&ff=20250824151739&v=2.18.0.post9+e462414"
"Korea University & SNU","2025-08-23","Water quality variables and spectral indices as predictors of E. coli concentrations in an irrigation pond: A case study","Computer Science","","https://pubmed.ncbi.nlm.nih.gov/40848368/?utm_source=Other&utm_medium=rss&utm_campaign=pubmed-2&utm_content=1bo4uOs-bB_ZLOeoRMDuMyKrqOCTTJrR8i4c8aBDtpAcbJ09ch&fc=20250822163228&ff=20250824151739&v=2.18.0.post9+e462414"
"SNU","2025-08-23","Using natural nitrites from Angelica keiskei and high hydrostatic pressure treatment for producing high-quality cured pork loin with significant nitrous pigment formation","Multidisciplinary","","https://pubmed.ncbi.nlm.nih.gov/40848341/?utm_source=Other&utm_medium=rss&utm_campaign=pubmed-2&utm_content=1bo4uOs-bB_ZLOeoRMDuMyKrqOCTTJrR8i4c8aBDtpAcbJ09ch&fc=20250822163228&ff=20250824151739&v=2.18.0.post9+e462414"
"SKKU & SNU","2025-08-23","Tumor microenvironment-based classification for predicting gastric cancer prognosis","Cancer Research","","https://pubmed.ncbi.nlm.nih.gov/40848322/?utm_source=Other&utm_medium=rss&utm_campaign=pubmed-2&utm_content=1bo4uOs-bB_ZLOeoRMDuMyKrqOCTTJrR8i4c8aBDtpAcbJ09ch&fc=20250822163228&ff=20250824151739&v=2.18.0.post9+e462414"
"Korea University & SNU","2025-08-23","DeepSMR: Decoding high-complex motor imagery via subject-dependent multi-feature refinement in deep convolutional networks","Neuroscience","science","https://pubmed.ncbi.nlm.nih.gov/40848318/?utm_source=Other&utm_medium=rss&utm_campaign=pubmed-2&utm_content=1bo4uOs-bB_ZLOeoRMDuMyKrqOCTTJrR8i4c8aBDtpAcbJ09ch&fc=20250822163228&ff=20250824151739&v=2.18.0.post9+e462414"
"Korea University & SNU","2025-08-23","The Molecular Dynamics of Extracellular Vesicles and their Protein Corona in the Secretomes of Stem Cells","Multidisciplinary","cell","https://pubmed.ncbi.nlm.nih.gov/40848102/?utm_source=Other&utm_medium=rss&utm_campaign=pubmed-2&utm_content=1bo4uOs-bB_ZLOeoRMDuMyKrqOCTTJrR8i4c8aBDtpAcbJ09ch&fc=20250822163228&ff=20250824151739&v=2.18.0.post9+e462414"
"SNU","2025-08-23","Association Between ABCG2 Polymorphism and Statin-Induced Adverse Events: A Meta-Analysis","Multidisciplinary","","https://pubmed.ncbi.nlm.nih.gov/40848094/?utm_source=Other&utm_medium=rss&utm_campaign=pubmed-2&utm_content=1bo4uOs-bB_ZLOeoRMDuMyKrqOCTTJrR8i4c8aBDtpAcbJ09ch&fc=20250822163228&ff=20250824151739&v=2.18.0.post9+e462414"
"SNU","2025-08-23","Electronic Configurational Transformation of Network Modifiers in Aluminate Glass above Megabar Pressures","Multidisciplinary","","https://pubmed.ncbi.nlm.nih.gov/40847942/?utm_source=Other&utm_medium=rss&utm_campaign=pubmed-2&utm_content=1bo4uOs-bB_ZLOeoRMDuMyKrqOCTTJrR8i4c8aBDtpAcbJ09ch&fc=20250822163228&ff=20250824151739&v=2.18.0.post9+e462414"
"SNU","2025-08-23","Microfocused Ultrasound With Visualization in Skin Quality: A Narrative Review","Multidisciplinary","","https://pubmed.ncbi.nlm.nih.gov/40847904/?utm_source=Other&utm_medium=rss&utm_campaign=pubmed-2&utm_content=1bo4uOs-bB_ZLOeoRMDuMyKrqOCTTJrR8i4c8aBDtpAcbJ09ch&fc=20250822163228&ff=20250824151739&v=2.18.0.post9+e462414"
"SNU","2025-08-23","How to Treat Skin Quality: A Consensus-Based Treatment Algorithm and Expert Guidance","Multidisciplinary","","https://pubmed.ncbi.nlm.nih.gov/40847902/?utm_source=Other&utm_medium=rss&utm_campaign=pubmed-2&utm_content=1bo4uOs-bB_ZLOeoRMDuMyKrqOCTTJrR8i4c8aBDtpAcbJ09ch&fc=20250822163228&ff=20250824151739&v=2.18.0.post9+e462414"
"SNU","2025-08-23","Retrospective analysis of aripiprazole augmentation and serotonin norepinephrine reuptake inhibitor switching in epilepsy patients with selective serotonin reuptake inhibitors-resistant depression","Biomedical","","https://pubmed.ncbi.nlm.nih.gov/40847771/?utm_source=Other&utm_medium=rss&utm_campaign=pubmed-2&utm_content=1bo4uOs-bB_ZLOeoRMDuMyKrqOCTTJrR8i4c8aBDtpAcbJ09ch&fc=20250822163228&ff=20250824151739&v=2.18.0.post9+e462414"
"SNU","2025-08-23","Restorative Effects of Low-Temperature Post-Sulfur Annealing on Device Performance of Monolayer MoS<sub>2</sub> Transistors for NMOS Inverters","Materials Science","","https://pubmed.ncbi.nlm.nih.gov/40847740/?utm_source=Other&utm_medium=rss&utm_campaign=pubmed-2&utm_content=1bo4uOs-bB_ZLOeoRMDuMyKrqOCTTJrR8i4c8aBDtpAcbJ09ch&fc=20250822163228&ff=20250824151739&v=2.18.0.post9+e462414"
"SNU","2025-08-23","Maxwell Protocol for Non-Destructive Health Diagnosis of All-Solid-State Batteries","Multidisciplinary","cell","https://pubmed.ncbi.nlm.nih.gov/40847721/?utm_source=Other&utm_medium=rss&utm_campaign=pubmed-2&utm_content=1bo4uOs-bB_ZLOeoRMDuMyKrqOCTTJrR8i4c8aBDtpAcbJ09ch&fc=20250822163228&ff=20250824151739&v=2.18.0.post9+e462414"
